{
  "contract": "publishing-house.workflow-run-request/v1",
  "schema_name": "publishing-house.workflow-run-request",
  "schema_version": "1.0.0",
  "workflow_id": "publishing-house-daily-desk",
  "workflow_version": "0.1.0",
  "run_id": "run-fixture-daily",
  "correlation_id": "correlation-fixture",
  "created_at": "2026-08-14T12:00:00Z",
  "actor": "fixture-operator",
  "permission_mode": "PROPOSE",
  "mode": "fixture",
  "profiles": {
    "house": "fixtures/publishing-house/house-profile.fixture.json"
  },
  "capabilities": [
    {
      "name": "storydesk",
      "available": true
    }
  ],
  "input": {
    "source_packet": "fixtures/publishing-house/daily-packet.fixture.json"
  },
  "external_effects_allowed": false
}
